id,chapter,question,answer,evidence,date,location,entity,content,retrieval_type_est,minerva_category_est,cue_est
1,1,What is the name of the course where Ezra Edwards is competing?,Bethpage Black Course,Bethpage Black Course. Ezra Edwards. Demonstrated cat leaps.,"September 13, 2025",Bethpage Black Course,Ezra Edwards,Parkour Workshop,Spaces,Search,"(*, *, ent, *)"
2,2,What is the name of the museum where Chloe's designs are being unveiled?,American Museum of Natural History,American Museum of Natural History.,"September 22, 2026",American Museum of Natural History,Chloe Castillo,Fashion Show,Spaces,Search,"(*, *, *, *)"
3,3,"Who explained post-processing techniques on September 22, 2026?",Henry Reed,Henry Reed. Explained post-processing techniques.,"September 22, 2026",Port Jefferson,Henry Reed,Photography Exhibition,Entities,Search,"(t, *, *, *)"
4,4,What was the name of the park where Zoe performed?,Hither Hills State Park,"The park itself, , felt secretive, the trees pressing close, as if the night was being held captive between earth and sky. Hither Hills State Park.","May 07, 2024",Hither Hills State Park,Zoe Brown,Karaoke Night,Spaces,Search,"(*, *, *, *)"
5,5,What is the name of the elevated promenade where Logan is standing?,The High Line,"Along the elevated promenade, steel and glass rose into the cool air like a skyline reborn—this was the , transformed tonight into a maze of polished tables and the murmur of ambition.","March 23, 2024",High Line,Logan Diaz,Business Networking Event,Spaces,Search,"(*, *, *, *)"
6,6,What was the date that hung in the air during the incident?,"May 31, 2024","The date hung in the air: . The clock faces in every corner seemed to sync to this unspoken fact, marking the.","May 31, 2024",Woolworth Building,Julian Ross,Tech Hackathon,Times,Search,"(*, *, *, *)"
7,7,What is the name of the park where Benjamin is conducting his ice preservation talks?,Washington Square Park,"In this moment of quiet before another. Washington Square Park. February 27, 2026.","February 27, 2026",Washington Square Park,Benjamin Green,Ice Sculpture Exhibition,Spaces,Search,"(*, *, *, *)"
8,8,What was the date of the workshop?,"September 27, 2025","Today’s date blinked at him from his phone, , scrawled in the digital corner with all the gravitas of a Monday morning.","September 27, 2025",Snug Harbor Cultural Center,Owen Thomas,Parkour Workshop,Times,Search,"(*, *, *, *)"
9,9,What date was the performance?,"February 27, 2026","The voice—clear as crystal, yet vibrating with ancient sorrow—echoed through the space. February 27, 2026.","February 27, 2026",Statue of Liberty,Mila Gonzalez,Theater Performance,Times,Search,"(*, *, *, *)"
10,10,What day was the Midnight Premier and Poster Expo held?,"October 13, 2024","At precisely the stated beginning of the “Midnight Premier and Poster Expo” at 7:15 p.m., Henry stepped onto the bridge proper.","October 13, 2024",Queensboro Bridge,Henry Reed,Film Festival,Times,Search,"(*, *, *, *)"
11,11,Who conducted ice-themed music performances in Washington Square Park?,Henry Reed,"She handed out pamphlets, her fingers cool from the ice blocks she handled. Henry Reed. Conducted ice-themed music performances.","May 11, 2026",Washington Square Park,Henry Reed,Ice Sculpture Exhibition,Entities,Search,"(*, s, *, *)"
12,12,What is the name of the place where Chloe is waiting?,The High Line,"High Line. May 11, 2026.","May 11, 2026",High Line,Chloe Castillo,Parkour Workshop,Spaces,Search,"(*, *, *, *)"
13,13,What is the name of the self-declared liquid archaeologist?,Axl Mims,"I, Axl Mims—a self-declared liquid archaeologist with a passion for hops and a knack for organizing slightly chaotic gatherings—stood at the entrance,","October 13, 2024",Woolworth Building,Scarlett Thomas,Craft Beer Festival,Event contents,Search,"(*, *, *, *)"
14,14,What was Benjamin's goal at the Snug Harbor Cultural Center?,To form a team and build something that would catch the eye of the judges,"He had come prepared, not just with algorithms and frameworks, but with a quiet resolve to form a team, to build something that would catch the eye of the judges and maybe, just maybe, the spark of another kind of attention.","April 09, 2026",Snug Harbor Cultural Center,Benjamin Green,Tech Hackathon,Event contents,Search,"(*, s, *, *)"
15,15,What is the name of the host of the evening's astronomy trivia contests?,Levi Rodriguez,"Finally, Levi Rodriguez, host of the evening’s astronomy trivia contests, raised a gloved hand.","December 26, 2026",American Museum of Natural History,Levi Rodriguez,Astronomy Night,Entities,Search,"(*, *, *, *)"
16,16,What date was the Hackathon held on?,"March 23, 2024","Port Jefferson. March 23, 2024.","March 23, 2024",Port Jefferson,Zoe Brown,Tech Hackathon,Times,Search,"(*, *, *, *)"
17,17,What was the name of the project that Zoe was presenting?,neural interface for real-time translation,her project—a neural interface for real-time translation—hovering between finished and broken.,"June 14, 2025",High Line,Zoe Brown,Tech Hackathon,Event contents,Search,"(*, *, *, *)"
18,18,What was the title of the speech Mila had rehearsed with the audience in mind?,the delicate art of audience interaction,"She had spoken, that day, about the delicate art of audience interaction, how a whisper could fracture a mood or heal it with a single glance.","January 03, 2026",St. Patrick's Cathedral,Mila Gonzalez,Theater Performance,Event contents,Search,"(*, *, *, *)"
19,19,What was the date mentioned in the chapter?,"February 27, 2026","The date hung in his mind: , a year that promised closure but offered only silence.","February 27, 2026",High Line,Jackson Ramos,Theater Performance,Times,Search,"(*, *, *, *)"
20,20,What is the name of the bridge where the historical fashion show is taking place?,Brooklyn Bridge,"Across the span, actors assembled for a Civil War ball, their costuming immaculate, their gestures stiff and ritualistic.","September 03, 2026",Brooklyn Bridge,Hazel Lewis,Historical Reenactment,Spaces,Search,"(*, *, *, *)"
21,21,What is the name of the bridge where the event is taking place?,The Williamsburg Bridge,The Williamsburg Bridge.,"February 27, 2026",Williamsburg Bridge,Julian Ross,Tech Hackathon,Spaces,Search,"(*, *, *, *)"
22,22,What day was the compound bow competition held?,"March 23, 2024","Washington Square Park. March 23, 2024. Mila Gonzalez.","March 23, 2024",Washington Square Park,Mila Gonzalez,Archery Tournament,Times,Search,"(*, *, *, *)"
23,23,Who is the designer of the blue-lacquered dress that Lily is wearing?,Quill Womack,"The designer, Quill Womack, had stopped by earlier to discuss her vision,","April 09, 2026",Brooklyn Museum,Lily Nguyen,Fashion Show,Entities,Search,"(*, *, *, *)"
24,24,What is the key to understanding learning analytics?,Interpreting patterns hidden within data streams.,the key to understanding learning analytics is in how we interpret the patterns hidden within these data streams.,"December 03, 2026",New York Botanical Garden,Ezra Edwards,Educational Workshop,Event contents,Search,"(*, *, *, *)"
25,25,What is the name of the protagonist in the play?,The protagonist is a ghost,a ghost in the steel's shadow,"September 27, 2025",One World Trade Center,Samuel Parker,Theater Performance,Event contents,Search,"(*, *, *, *)"
26,26,What date was burned into Mila's bones?,"June 14, 2025","The date, , was not written upon the invitation but burned into her bones with every detail she selected.","June 14, 2025",Brooklyn Museum,Mila Gonzalez,Murder Mystery Dinner,Times,Search,"(*, *, *, *)"
27,27,What was the event that Noah was initially supposed to attend?,The TED Talk: The Power of Resilience,His phone’s screen still showed the reminder: “TED Talk: The Power of Resilience – 4:50 PM.”,"September 22, 2026",Williamsburg Bridge,Noah Williams,TED Talk,Event contents,Search,"(*, *, *, *)"
28,28,What is the name of the museum where Zoe is conducting astronomy app tutorials?,The Metropolitan Museum of Art,"The grand marble steps echoed with the hush of a crowd, the air cool with autumn and the faint, metallic tang of city lights filtering through the soaring vaults of the . Shadows danced along the iron railings, flickering as spotlights traced paths through the museum’s endless galleries, illuminating sculptures and tapestries that seemed frozen in time.","October 12, 2024",Metropolitan Museum of Art,Zoe Brown,Astronomy Night,Spaces,Search,"(*, *, *, *)"
29,29,What is the name of the museum where the film festival is held?,American Museum of Natural History,"The grand entry hall of the , casting intricate shadows across the stone archways.","October 27, 2024",American Museum of Natural History,Julian Ross,Film Festival,Spaces,Search,"(*, *, *, c)"
30,30,"What was Carter's role in the performance at Yankee Stadium on January 3rd, 2026?",He was a mime.,"Tonight, he would not speak. He would be the whisper between gestures, the shape the air took when meaning walked quietly.","January 03, 2026",Yankee Stadium,Carter Stewart,Theater Performance,Times,Search,"(*, s, *, *)"
31,31,What was the principal dancer's name that Carter recognized?,Amir Woo,"He recognized her—Amir Woo—the principal dancer,","October 27, 2024",Port Jefferson,Carter Stewart,Ballet Performance,Event contents,Search,"(*, *, *, *)"
32,32,What date is marked on the entrance of the High Line gallery?,"September 22, 2026","High Line. September 22, 2026.","September 22, 2026",High Line,Julian Ross,Fashion Show,Times,Search,"(*, s, *, *)"
33,33,Who is the conductor of the orchestra?,Pax Talley,"Samuel recognized Pax Talley, the conductor, his silhouette sharp against the indigo wash, baton poised.","October 12, 2024",Fire Island National Seashore,Samuel Parker,Theater Performance,Entities,Search,"(*, *, *, *)"
34,34,Who was the dancer performing the fire puppyhammer technique?,Lucy Carter,"The dancer stepped from the ring, trailing glowing cinders, her. Lucy Carter.","October 09, 2025",High Line,Lucy Carter,Fire Dancing Performance,Entities,Search,"(*, *, *, *)"
35,35,What is the name of the place where Lillian is trying to decide whether to sing?,Chelsea Market,Chelsea Market.,"November 13, 2026",Chelsea Market,Lillian Mendoza,Karaoke Night,Spaces,Search,"(*, *, *, *)"
36,36,What is the name of the building where Noah is waiting?,The Woolworth Building,"The lobby’s seats, the glass of the nearby store windows, the projection shimmered: the grandeur of the Woolworth’s upper floors","September 13, 2025",Woolworth Building,Noah Williams,Theater Performance,Spaces,Search,"(*, *, *, *)"
37,37,What date was the event held on?,"November 13, 2026","November 13, 2026.","November 13, 2026",Long Beach Boardwalk,Henry Reed,Fashion Show,Times,Search,"(*, *, *, *)"
38,38,Who was chosen to act as the silent arbiter of logic and chaos at the code reviews?,Henry Reed,"Teams were rushing toward the final round of code reviews, and Henry had been chosen—yet again—to act as the silent arbiter of logic and grace among chaos.","March 23, 2024",Yankee Stadium,Henry Reed,Tech Hackathon,Entities,Search,"(*, *, *, *)"
39,39,What was the date of the performance on the Williamsburg Bridge?,"November 13, 2026","The clock above the souvenir kiosk ticked, steady and deliberate, as if time itself waited for the performance to peak. —she would remember only this date long after, as the one when fire seemed to remember her most.","November 13, 2026",Williamsburg Bridge,Olivia Turner,Fire Dancing Performance,Times,Search,"(*, s, *, *)"
40,40,Where was the educational workshop on industry relevance held?,The Metropolitan Museum of Art,"On , pushed through the marble vestibule of the , the hushed thrum of hundreds of feet and murmured French echoing between vaulted ceilings.","May 11, 2026",Metropolitan Museum of Art,Samuel Parker,Educational Workshop,Spaces,Search,"(*, *, *, c)"
41,41,What was the date of the event where Zoe was a judging panel member?,"January 26, 2025","January 26, 2025. Zoe Brown.","January 26, 2025",One World Trade Center,Zoe Brown,Tech Hackathon,Times,Search,"(*, *, *, *)"
42,42,"What is the name of the festival being celebrated on October 13, 2024?",Brooklyn Ross,Hosted film award ceremonies.,"October 13, 2024",High Line,Brooklyn Ross,Film Festival,Entities,Search,"(t, *, *, *)"
43,43,What was the rare celestial alignment that Bella Alvarez had been waiting for?,a convergence of celestial alignment and human curiosity,"she knew tonight was special, a rare convergence of celestial alignment and human curiosity,","May 11, 2026",Williamsburg Bridge,Bella Alvarez,Astronomy Night,Event contents,Search,"(*, *, ent, *)"
44,44,What date was Hazel's work unveiled?,"February 27, 2026","February 27, 2026.","February 27, 2026",One World Trade Center,Hazel Lewis,Fashion Show,Times,Search,"(*, *, *, *)"
45,45,Who is the author being introduced?,Scarlett Thomas,"She carried herself with that same careful gravity she’d spoken of in her interviews, the weight of explanation pressing on her chest as she was introduced, her voice steady but edged with the unspoken awareness of how stories end even before the final page.","June 14, 2025",The Vessel at Hudson Yards,Scarlett Thomas,Book Signing Event,Entities,Search,"(*, *, *, *)"
46,46,Who conducted celestial navigation workshops?,Vada Dunning,"She eyed the horizon, noting the faint shimmer of cloud that still drifted beneath the city's distant towers. On the far end, Vada Dunning—a woman. Conducted celestial navigation workshops.","April 09, 2026",High Line,Scarlett Thomas,Astronomy Night,Entities,Search,"(*, *, *, *)"
47,47,What is the name of the seminar Henry is conducting?,Body Language for Debate Victory,"His seminar today was “Body Language for Debate Victory,”","March 23, 2025",One World Trade Center,Henry Reed,Debate Tournament,Event contents,Search,"(*, *, *, *)"
48,48,What is the name of the elevated walkway mentioned in the chapter?,The High Line,"The name itself seemed to hum in the air, a phrase spoken in reverence, as if naming the structure altered its essence.","May 28, 2025",High Line,Henry Reed,Debate Tournament,Spaces,Search,"(*, *, *, *)"
49,49,What date was it when Zoe Brown conducted a celestial navigation workshop in Washington Square Park?,"December 26, 2026","The date——was almost invisible, marked only by the faint chill of winter and the knowledge that the sky tonight would change nothing for most, but everything for her students. December 26, 2026.","December 26, 2026",Washington Square Park,Zoe Brown,Astronomy Night,Times,Search,"(*, s, ent, *)"
50,50,What is the main topic of Carter's lecture?,Statistical analysis,"“Understanding variance, hypothesis testing, and p-values isn’t merely technique,” he explained, tapping at a digital tablet. “It’s about discerning patterns in chaos—decoding what is real from what is noise.”","September 22, 2026",Metropolitan Museum of Art,Carter Stewart,Scientific Conference,Event contents,Search,"(*, *, *, *)"
51,51,What is the name of the leader in the first circle?,Daisy Whittington,a woman with hair spun from silver mist and eyes like polished onyx (she called herself Daisy Whittington),"May 14, 2025",Yankee Stadium,Julian Ross,Educational Workshop,Event contents,Search,"(*, *, *, *)"
52,52,What was Lucy's contribution to the demo?,She integrated third-party services into their demo.,"Her hands danced over a tablet as she synced a weather API with a chatbot and a food delivery platform all at once; the resulting interface flickered into life with a dramatic “BINGO!” sound,","November 13, 2026",Statue of Liberty,Lucy Carter,Tech Hackathon,Event contents,Search,"(*, *, *, *)"
53,53,What was the name of the event where Levi was attending?,Snug Harbor's annual Tech Hackathon,"“Welcome, everyone, to Snug Harbor’s annual Tech Hackathon!”","July 25, 2024",Snug Harbor Cultural Center,Levi Rodriguez,Tech Hackathon,Event contents,Search,"(*, *, *, *)"
54,54,What was Levi's emotional response to the music about to begin?,He felt an unfamiliar warmth in his chest.,"For Levi, the act of listening was as much a ritual as breathing; in that moment, he knew he was here to witness more than a performance, but a conversation across time and space.","June 14, 2025",One World Trade Center,Levi Rodriguez,Classical Music Concert,Event contents,Search,"(*, *, *, *)"
55,55,What is the name of the venue where the conference is being held?,Snug Harbor Cultural Center,The conference hall was held at the Snug Harbor Cultural Center.,"May 28, 2025",Snug Harbor Cultural Center,Levi Rodriguez,Scientific Conference,Spaces,Search,"(*, *, *, *)"
56,56,What was the name of the museum where Carter was leading a fitness class?,American Museum of Natural History,"American Museum of Natural History. September 13, 2025.","September 13, 2025",American Museum of Natural History,Carter Stewart,Parkour Workshop,Spaces,Search,"(*, *, *, *)"
57,57,What was the name of the event that had been named in Zoe's honor?,Bethpage Black Course,The event had been named in her honor—a Bethpage Black Course.,"November 13, 2026",Bethpage Black Course,Zoe Brown,Photography Exhibition,Spaces,Search,"(*, *, *, *)"
58,58,What instrument did Genevieve Kelley play in the orchestra?,Genevieve Kelley played the cello.,"The orchestra’s cellist—Genevieve Kelley—waited, poised and silent, eyes closed as though holding the music in his lungs.","May 11, 2026",Trinity Church,Levi Rodriguez,Classical Music Concert,Event contents,Search,"(*, *, *, *)"
59,59,What was the name of the person who was an architect of possibilities and revealed upcoming trends?,Lillian Mendoza,Lillian Mendoza. Revealed upcoming trends.,"September 13, 2025",Yankee Stadium,Lillian Mendoza,Fashion Show,Entities,Search,"(*, *, *, *)"
60,60,Who was the mastermind behind the organized murder mystery weekend retreat?,Noah Williams,No one knew except as the mastermind behind this curated weekend—the man who had carefully constructed the scenario so the game could begin with a shock.,"June 14, 2025",Trinity Church,Noah Williams,Murder Mystery Dinner,Entities,Search,"(*, *, *, *)"
61,61,What was the name whispered in the air at the fairgrounds?,Bethpage Black Course,", was the name whispered in the air—unspoken, yet undeniable.","July 25, 2024",Bethpage Black Course,Logan Diaz,Job Fair,Spaces,Search,"(*, *, *, *)"
62,62,What was the time when Carter Stewart was running behind schedule?,9:47 AM,"The clock on the wall read 9:47 AM,","May 11, 2026",Woolworth Building,Carter Stewart,Educational Workshop,Event contents,Search,"(*, *, ent, *)"
63,63,What is the main event that Maya has organized for the night?,astrophotography workshops,"The astrophotography workshops she’d organized were finally underway,","May 11, 2026",Port Jefferson,Maya Smith,Astronomy Night,Event contents,Search,"(*, *, *, *)"
64,64,Who was Zoe watching closely during the performance?,"Alec Simonson, the lead performer","The lead performer, Alec Simonson, flicked her arm, a crystal ball of fire arced through the air.","January 03, 2026",Statue of Liberty,Zoe Brown,Fire Dancing Performance,Entities,Search,"(*, *, *, *)"
65,65,Who did Benjamin meet with before the fashion show?,fashion critics,"He had met with them earlier, in the hush before the curtain rose, their voices a soft current as they questioned the designers about ambition and illusion.","March 23, 2024",Bethpage State Park,Benjamin Green,Fashion Show,Entities,Search,"(*, *, *, c)"
66,66,What was the date of the event described in the chapter?,"September 13, 2025","St. Patrick's Cathedral. September 13, 2025.","September 13, 2025",St. Patrick's Cathedral,Henry Reed,Carnival,Times,Search,"(*, *, *, *)"
67,67,What is the name of the playwright?,Brooklyn Ross,"On stage, silhouettes flickered beneath the downlit proscenium, shadows stretching long across the gilded proscenium arch above her. She wore a plain black dress, her fingers tightening around the program as the curtain lifted, revealing a single figure on center stage, bathed in a wash of indigo. Brooklyn Ross.","August 24, 2026",Brooklyn Museum,Brooklyn Ross,Theater Performance,Entities,Search,"(*, *, *, *)"
68,68,What is the name of the new device being demonstrated?,The new device,"A screen behind her displayed a model of the new device, unblemished and radiant beneath cold white light.","February 27, 2026",Museum of Modern Art,Maya Smith,Tech Product Launch,Event contents,Search,"(*, *, *, *)"
69,69,What is the unusual sheen on the Statue of Liberty's iron tonight?,"It has an opalescent sheen, as if kissed by moonlight trapped in starlight.","Above the endless blue, the colossal silhouette of the glowed, not with the usual patina of rust, but tonight with an unnatural, opalescent sheen—as if the iron had been kissed by moonlight trapped in starlight.","April 09, 2026",Statue of Liberty,Lucy Carter,Theater Performance,Event contents,Search,"(*, s, *, *)"
70,70,What is the core of Julian's company culture?,Alignment of values and purpose above profit margins,Our culture is built on radical transparency and empathy for both clients and team members.,"November 13, 2026",Ellis Island,Julian Ross,Business Networking Event,Event contents,Search,"(*, *, *, *)"
71,71,What was the time when the clock on the wall blinked midnight?,midnight,"It was during the serving of the main course, amidst the clatter and murmurs of the crowd, that the clock on the wall blinked midnight.","June 14, 2025",Queensboro Bridge,Brooklyn Ross,Murder Mystery Dinner,Event contents,Search,"(*, *, *, *)"
72,72,Who is the curator of the exhibit where Scarlett is tracking patterns and discrepancies?,Gracie Weeks,The curator—a bespectacled woman in her late forties marked as Gracie Weeks—gestured toward a monitor showing an out-of-focus clip.,"March 23, 2024",Metropolitan Museum of Art,Scarlett Thomas,Film Festival,Entities,Search,"(*, *, *, *)"
73,73,What is the name of the museum where the event is taking place?,Water Mill Museum,"At the heart of it all sprawled the main stage, an open arena set within the restored industrial chamber of .","March 23, 2025",Water Mill Museum,Aurora Chavez,Tech Hackathon,Spaces,Search,"(*, *, *, *)"
74,74,What is the name of the skyscraper where Julian is located?,One World Trade Center,One World Trade Center.,"March 23, 2024",One World Trade Center,Julian Ross,Tech Hackathon,Spaces,Search,"(*, *, *, *)"
75,75,What was the date of the conference?,"July 21, 2024","July 21, 2024.","July 21, 2024",Washington Square Park,Benjamin Green,Scientific Conference,Times,Search,"(*, *, *, *)"
76,76,What is the name of the building where Maya is hosting a celebrity ghost hunting event?,One World Trade Center,"A nearby plaque explained, with great seriousness, “This site is a nexus for the afterlife.” Maya checked her watch: 8:47 PM on September 3rd—no time for a panic attack. One World Trade Center. Maya Smith.","September 03, 2026",One World Trade Center,Maya Smith,Ghost Tour,Spaces,Search,"(*, *, *, *)"
77,77,What was the name of the company that Levi was interested in applying to?,Diversity First Solutions,A stall with a bold sign: “Diversity First Solutions—Apply Now!”,"March 23, 2024",Woolworth Building,Levi Cruz,Job Fair,Event contents,Search,"(*, *, *, *)"
78,78,What is the name of the building where Mila is working?,The Woolworth Building,"Woolworth Building. March 23, 2025.","March 23, 2025",Woolworth Building,Mila Gonzalez,Tech Hackathon,Spaces,Search,"(*, *, *, *)"
79,79,What date was the corset-making workshop conducted?,"September 13, 2025","September 13, 2025. Conducted corset-making workshop.","September 13, 2025",Washington Square Park,Julian Ross,Burlesque Performance,Times,Search,"(*, *, *, *)"
80,80,What is the name of the hall where Samuel watches the performance?,The Hall of Mollusks,"Inside the mollusk hall, the ceiling above shimmered with constellations that mapped forgotten seas, each star a glimmering shell fragment, suspended and softly humming.","April 09, 2026",American Museum of Natural History,Samuel Parker,Theater Performance,Spaces,Search,"(*, *, *, *)"
81,81,What date was the model casting event?,"May 11, 2026","Tonight’s event promised to be the most consequential casting session she’d attended all year; rumors swirled behind closed doors that this show could change careers overnight, or worse, bring unexpected attention to a secret nobody was supposed to see. May 11, 2026. Discussed model casting.","May 11, 2026",Museum of Modern Art,Scarlett Thomas,Fashion Show,Times,Search,"(*, *, *, *)"
82,82,What date was the workshop scheduled for?,"September 3, 2026","The date was etched in her mind—September 3, 2026—but she kept it silent,","September 03, 2026",Van Cortlandt Park,Mila Gonzalez,Educational Workshop,Event contents,Search,"(*, *, *, *)"
83,83,What date was the exhibition held?,"September 03, 2026","September 03, 2026. Levi Rodriguez.","September 03, 2026",Washington Square Park,Levi Rodriguez,Film Festival,Times,Search,"(*, *, *, *)"
84,84,What date is mentioned in the chapter?,"November 13, 2026","November 13, 2026.","November 13, 2026",Fire Island National Seashore,Brooklyn Ross,Tech Hackathon,Times,Search,"(*, *, *, *)"
85,85,What date did Henry Reed's photographs go on display?,"October 27, 2024","As the lights dimmed and the opening speech concluded, Henry stood before his own aerial images, the audience falling silent. Only then did the date——feel pressing, as if the stone bridge itself remembered it.","October 27, 2024",Brooklyn Bridge,Henry Reed,Photography Exhibition,Times,Search,"(*, *, ent, *)"
